{
  "$schema": "https://json-schema.org/draft/2020-12/schema",
  "$id": "https://github.com/tiepnv2508/us-credit-card-benefits/schema/card.schema.json",
  "title": "US credit card",
  "description": "One US credit card: identity, annual fee and every recurring benefit (statement credits and perks).",
  "type": "object",
  "additionalProperties": false,
  "required": [
    "id",
    "name",
    "issuer",
    "network",
    "isBusiness",
    "currency",
    "annualFee",
    "afWaivedFirstYear",
    "discontinued",
    "lastVerified",
    "sources",
    "benefits"
  ],
  "properties": {
    "$schema": {
      "type": "string"
    },
    "id": {
      "type": "string",
      "pattern": "^[a-z0-9]+(-[a-z0-9]+)*$",
      "description": "Stable id: <issuer-short>-<card-slug>, e.g. \"amex-gold\". Never reuse or rename once published."
    },
    "name": {
      "type": "string",
      "minLength": 1,
      "description": "Card name without the issuer and without ®/™, e.g. \"Gold\", \"Sapphire Reserve\"."
    },
    "issuer": {
      "type": "string",
      "enum": [
        "AMERICAN_EXPRESS",
        "BANK_OF_AMERICA",
        "BARCLAYS",
        "BREX",
        "CAPITAL_ONE",
        "CHASE",
        "CITI",
        "COMENITY",
        "DISCOVER",
        "FIRST",
        "FNBO",
        "PENFED",
        "PNC",
        "SYNCHRONY",
        "US_BANK",
        "WEB_BANK",
        "WELLS_FARGO",
        "BILT",
        "OTHER"
      ]
    },
    "network": {
      "enum": [
        "visa",
        "mastercard",
        "amex",
        "discover",
        null
      ],
      "description": "Payment network (null if unknown)."
    },
    "isBusiness": {
      "type": "boolean"
    },
    "currency": {
      "type": "string",
      "description": "Rewards currency code, e.g. USD (cash back), AMERICAN_EXPRESS (MR), CHASE (UR), CITI (TYP), DELTA, MARRIOTT, HILTON…"
    },
    "annualFee": {
      "type": "number",
      "minimum": 0,
      "description": "Current annual fee in USD."
    },
    "afWaivedFirstYear": {
      "type": "boolean"
    },
    "discontinued": {
      "type": "boolean",
      "description": "Closed to new applicants (existing cardholders may keep benefits)."
    },
    "url": {
      "type": "string",
      "format": "uri",
      "description": "Issuer card page."
    },
    "notes": {
      "type": "string",
      "maxLength": 300,
      "description": "Card-level caveats a user should know when picking the card (e.g. a membership the no-fee pricing depends on, a fee range set by creditworthiness, the real issuing bank of a co-brand)."
    },
    "imageUrl": {
      "type": "string",
      "format": "uri",
      "description": "Card art image (issuer-hosted or licensed). Optional."
    },
    "signupBonus": {
      "type": "object",
      "additionalProperties": false,
      "required": [
        "amount",
        "spend",
        "days",
        "asOf"
      ],
      "description": "Current public welcome offer. Optional — offers change often; include asOf.",
      "properties": {
        "amount": {
          "type": "number",
          "minimum": 0,
          "description": "Points/miles, or USD for cash-back cards."
        },
        "spend": {
          "type": "number",
          "minimum": 0,
          "description": "Minimum spend in USD."
        },
        "days": {
          "type": "integer",
          "minimum": 1,
          "description": "Spend window in days."
        },
        "details": {
          "type": "string"
        },
        "asOf": {
          "type": "string",
          "format": "date"
        }
      }
    },
    "legacyIds": {
      "type": "array",
      "items": {
        "type": "string"
      },
      "description": "Ids this card had in other catalogs (e.g. andenacitelli/credit-card-bonuses-api cardId) — lets apps migrate references."
    },
    "lastVerified": {
      "type": "string",
      "format": "date",
      "description": "YYYY-MM-DD the benefit list was last checked against the issuer's own benefits page."
    },
    "sources": {
      "type": "array",
      "minItems": 1,
      "items": {
        "type": "string",
        "format": "uri"
      },
      "description": "Issuer benefit pages (preferred) or reputable references used to verify this file."
    },
    "benefits": {
      "type": "array",
      "description": "EVERY recurring benefit of the card, whether or not you personally use it (empty array if the card has none). Apps let users untick what they don't want.",
      "items": {
        "$ref": "#/$defs/benefit"
      }
    },
    "earn": {
      "type": "object",
      "additionalProperties": false,
      "required": [
        "unit",
        "baseRate",
        "rates",
        "lastVerified"
      ],
      "description": "How the card earns on purchases, from the issuer's own page. Omit the whole field until verified; never estimate.",
      "properties": {
        "unit": {
          "type": "string",
          "enum": [
            "points",
            "miles",
            "cashback_percent"
          ],
          "description": "What a rate means: 3 = 3x points/miles, or 3 = 3% cash back."
        },
        "baseRate": {
          "type": "number",
          "minimum": 0,
          "description": "Rate on everything else."
        },
        "lastVerified": {
          "type": "string",
          "pattern": "^\\d{4}-\\d{2}-\\d{2}$"
        },
        "notes": {
          "type": "string",
          "maxLength": 300,
          "description": "Terms that change the rates as a whole, e.g. tiered housing rules."
        },
        "rates": {
          "type": "array",
          "items": {
            "type": "object",
            "additionalProperties": false,
            "required": [
              "category",
              "rate",
              "channel"
            ],
            "properties": {
              "category": {
                "type": "string",
                "enum": [
                  "dining",
                  "groceries",
                  "wholesale_clubs",
                  "gas",
                  "ev_charging",
                  "travel",
                  "flights",
                  "hotels",
                  "car_rental",
                  "transit",
                  "rideshare",
                  "streaming",
                  "drugstores",
                  "online_retail",
                  "entertainment",
                  "utilities",
                  "phone_internet",
                  "office_supplies",
                  "shipping",
                  "advertising",
                  "rent",
                  "brand",
                  "rotating",
                  "chosen_category",
                  "other"
                ],
                "description": "`brand` = the co-brand's own purchases (see `merchants`). `rotating` = quarterly categories to activate. `chosen_category` = the cardholder picks."
              },
              "rate": {
                "type": "number",
                "exclusiveMinimum": 0
              },
              "channel": {
                "type": "string",
                "enum": [
                  "any",
                  "issuer_portal",
                  "direct"
                ],
                "description": "any = any merchant in the category; issuer_portal = only when booked through the issuer's travel portal; direct = only booked directly with the airline/hotel."
              },
              "merchants": {
                "type": "string",
                "maxLength": 120,
                "description": "Who counts, when narrower than the category."
              },
              "cap": {
                "type": "object",
                "additionalProperties": false,
                "required": [
                  "amount",
                  "period"
                ],
                "properties": {
                  "amount": {
                    "type": "number",
                    "exclusiveMinimum": 0,
                    "description": "Dollars of spend at this rate."
                  },
                  "period": {
                    "type": "string",
                    "enum": [
                      "month",
                      "quarter",
                      "year"
                    ]
                  }
                }
              },
              "endDate": {
                "type": "string",
                "pattern": "^\\d{4}-\\d{2}-\\d{2}$"
              },
              "note": {
                "type": "string",
                "maxLength": 200
              }
            }
          }
        }
      }
    }
  },
  "$defs": {
    "benefit": {
      "type": "object",
      "additionalProperties": false,
      "required": [
        "id",
        "name",
        "type",
        "value",
        "frequency",
        "alignment",
        "category",
        "inApp",
        "enrollmentRequired",
        "matchKeywords",
        "matchVerified"
      ],
      "properties": {
        "id": {
          "type": "string",
          "pattern": "^[a-z0-9]+(-[a-z0-9]+)*$",
          "description": "Stable kebab-case id, unique within the card."
        },
        "name": {
          "type": "string",
          "minLength": 2,
          "maxLength": 40,
          "description": "Short display name, e.g. \"Uber Cash\", \"Resy credit\"."
        },
        "type": {
          "enum": [
            "credit",
            "perk"
          ],
          "description": "credit = dollar statement credit (value required); perk = non-cash benefit, optionally valued (lounge access, free night)."
        },
        "value": {
          "type": [
            "number",
            "null"
          ],
          "minimum": 0,
          "description": "USD value PER PERIOD (e.g. 15 for a $15/month credit). null = unvalued perk."
        },
        "frequency": {
          "enum": [
            "monthly",
            "quarterly",
            "semiannual",
            "annual",
            "custom"
          ]
        },
        "intervalMonths": {
          "type": "integer",
          "minimum": 1,
          "description": "Required when frequency is custom, e.g. 48 for a Global Entry credit every 4 years."
        },
        "alignment": {
          "enum": [
            "calendar",
            "anniversary"
          ],
          "description": "calendar = resets on Jan 1 / quarter / month boundaries; anniversary = resets on the cardmember year."
        },
        "category": {
          "enum": [
            "travel",
            "hotel",
            "dining",
            "rideshare",
            "entertainment",
            "shopping",
            "grocery",
            "security",
            "lounge",
            "bonus"
          ]
        },
        "inApp": {
          "type": "boolean",
          "description": "Applied inside a partner app/portal (Uber Cash, DashPass, Lyft, issuer travel portal) — no statement credit posts, so it can't be auto-matched."
        },
        "enrollmentRequired": {
          "type": "boolean"
        },
        "autoApplied": {
          "type": "boolean",
          "description": "Perks only: always on while you hold the card (elite status, lounge membership, free checked bags, flight discount, automatic anniversary points) — apps show it as active every period without the user marking it used. Omit/false for things you must redeem (free nights, companion certificates, passes, vouchers)."
        },
        "unlockSpend": {
          "type": "object",
          "additionalProperties": false,
          "required": [
            "amount",
            "window"
          ],
          "description": "The benefit only becomes available after the cardholder's TOTAL card purchases reach `amount` USD within `window` (e.g. Sapphire Reserve's $500 Southwest credit after $75,000 in a calendar year). Not for merchant-specific thresholds (\"$5,000 with Dell\") or spend that only upgrades a benefit you already have — keep those in notes.",
          "properties": {
            "amount": {
              "type": "number",
              "exclusiveMinimum": 0,
              "description": "USD of total card purchases needed."
            },
            "window": {
              "enum": [
                "calendar",
                "anniversary"
              ],
              "description": "calendar = Jan 1–Dec 31; anniversary = the cardmember year."
            }
          }
        },
        "matchKeywords": {
          "type": "array",
          "items": {
            "type": "string",
            "pattern": "^[a-z0-9]{3,}$"
          },
          "description": "Lower-case words that appear WHOLE in the statement-credit line (merchant/name/description). Prefer the most specific word(s); generic words (credit, fee, annual, amex, chase…) are ignored by matchers. Empty for inApp credits and perks."
        },
        "matchVerified": {
          "type": "boolean",
          "description": "true only if the keywords were seen on a real posted statement credit (add it to descriptorExamples)."
        },
        "descriptorExamples": {
          "type": "array",
          "items": {
            "type": "string"
          },
          "description": "Real statement-credit descriptors seen for this benefit, e.g. \"AMEX RESY CREDIT\"."
        },
        "notes": {
          "type": "string",
          "description": "Caveats: variable amounts (\"$35 in December\"), split periods, exclusions."
        },
        "endDate": {
          "type": "string",
          "format": "date",
          "description": "Last day of a limited-time benefit, if announced."
        }
      },
      "allOf": [
        {
          "if": {
            "properties": {
              "frequency": {
                "const": "custom"
              }
            }
          },
          "then": {
            "required": [
              "intervalMonths"
            ]
          }
        },
        {
          "if": {
            "properties": {
              "type": {
                "const": "credit"
              }
            }
          },
          "then": {
            "properties": {
              "value": {
                "type": "number"
              }
            }
          }
        },
        {
          "if": {
            "properties": {
              "inApp": {
                "const": true
              }
            }
          },
          "then": {
            "properties": {
              "matchKeywords": {
                "maxItems": 0
              }
            }
          }
        }
      ]
    }
  }
}
