{
  "$schema": "../../schema/card.schema.json",
  "id": "capitalone-spark-2-cash-plus",
  "name": "Spark 2% Cash Plus",
  "issuer": "CAPITAL_ONE",
  "network": "visa",
  "isBusiness": true,
  "currency": "USD",
  "annualFee": 150,
  "afWaivedFirstYear": false,
  "discontinued": false,
  "url": "https://www.capitalone.com/small-business/credit-cards/spark-cash-plus/",
  "legacyIds": [
    "9bd7d14db16dcc106d2eb062b08bf15f"
  ],
  "lastVerified": "2026-10-20",
  "sources": [
    "https://www.capitalone.com/small-business/credit-cards/spark-cash-plus/"
  ],
  "benefits": []
}
