{
  "$schema": "../../schema/card.schema.json",
  "id": "amex-blue-business-cash",
  "name": "Blue Business Cash",
  "issuer": "AMERICAN_EXPRESS",
  "network": "amex",
  "isBusiness": true,
  "currency": "USD",
  "annualFee": 0,
  "afWaivedFirstYear": false,
  "discontinued": false,
  "url": "https://www.americanexpress.com/en-us/business/credit-cards/blue-business-cash/",
  "imageUrl": "https://icm.aexp-static.com/Internet/Acquisition/US_en/AppContent/OneSite/open/category/cardarts/blue-business-cash.png",
  "legacyIds": [
    "a37efd1da4e7f0d468c87d3b6f021250"
  ],
  "lastVerified": "2026-10-20",
  "sources": [
    "https://www.americanexpress.com/en-us/business/credit-cards/blue-business-cash/"
  ],
  "benefits": []
}
