{
  "$schema": "../../schema/card.schema.json",
  "id": "capitalone-spark-1-classic",
  "name": "Spark 1% Classic",
  "issuer": "CAPITAL_ONE",
  "network": null,
  "isBusiness": true,
  "currency": "USD",
  "annualFee": 0,
  "afWaivedFirstYear": false,
  "discontinued": false,
  "url": "https://www.capitalone.com/small-business/credit-cards/spark-classic/",
  "lastVerified": "2026-11-01",
  "sources": [
    "https://www.capitalone.com/small-business/credit-cards/spark-classic/"
  ],
  "earn": {
    "unit": "cashback_percent",
    "baseRate": 1,
    "lastVerified": "2026-11-01",
    "rates": []
  },
  "benefits": []
}
