{
  "$schema": "../../schema/card.schema.json",
  "id": "amex-blue-business-plus",
  "name": "Blue Business Plus",
  "issuer": "AMERICAN_EXPRESS",
  "network": "amex",
  "isBusiness": true,
  "currency": "AMERICAN_EXPRESS",
  "annualFee": 0,
  "afWaivedFirstYear": false,
  "discontinued": false,
  "url": "https://www.americanexpress.com/us/credit-cards/business/business-credit-cards/american-express-blue-business-plus-credit-card-amex/",
  "imageUrl": "https://icm.aexp-static.com/Internet/Acquisition/US_en/AppContent/OneSite/open/category/cardarts/blue-business-plus.png",
  "legacyIds": [
    "a851f08b98f839a01a7e8fa367d8b8be"
  ],
  "lastVerified": "2026-10-20",
  "sources": [
    "https://www.americanexpress.com/us/credit-cards/business/business-credit-cards/american-express-blue-business-plus-credit-card-amex/",
    "https://www.americanexpress.com/us/credit-cards/card-application/apply/prospect/terms/bluebusinessplus-credit-card/42732-9-0"
  ],
  "earn": {
    "unit": "points",
    "baseRate": 1,
    "lastVerified": "2026-10-31",
    "rates": [
      {
        "category": "other",
        "rate": 2,
        "channel": "any",
        "cap": {
          "amount": 50000,
          "period": "year"
        },
        "note": "All eligible purchases, first $50,000 per calendar year, then 1X."
      },
      {
        "category": "travel",
        "rate": 2,
        "channel": "issuer_portal",
        "merchants": "AmexTravel.com",
        "note": "Stays 2X and does not count toward the $50,000."
      }
    ]
  },
  "benefits": []
}
