{
  "$schema": "../../schema/card.schema.json",
  "id": "citi-costco-anywhere-visa-business",
  "name": "Costco Anywhere Visa Business",
  "issuer": "CITI",
  "network": "visa",
  "isBusiness": true,
  "currency": "USD",
  "annualFee": 0,
  "afWaivedFirstYear": false,
  "discontinued": false,
  "url": "https://www.citi.com/credit-cards/costco-anywhere-visa-business-card",
  "notes": "No annual fee for the card itself, but a paid Costco business membership is required to get and keep it.",
  "imageUrl": "https://aemapi.citi.com/content/dam/cfs/uspb/usmkt/cards/en/static/images/citi-costco-anywhere-visa-business-credit-card/citi-costco-anywhere-visa-business-credit-card_306x192.webp",
  "lastVerified": "2026-10-20",
  "sources": [
    "https://www.citi.com/credit-cards/costco-anywhere-visa-business-card",
    "https://www.citi.com/credit-cards/view-all-credit-cards"
  ],
  "benefits": []
}
