{
  "$schema": "../../schema/card.schema.json",
  "id": "usbank-amazon-prime-business",
  "name": "Amazon Prime Business",
  "issuer": "US_BANK",
  "network": "mastercard",
  "isBusiness": true,
  "currency": "USD",
  "annualFee": 0,
  "afWaivedFirstYear": false,
  "discontinued": false,
  "url": "https://www.usbank.com/business-banking/business-credit-cards/amazon-business-credit-cards.html",
  "imageUrl": "https://m.media-amazon.com/images/G/01/SBCC/ZenithTest/DetailPage/SBCC_US_Prime_DP_Comparison_2x_280x176.png",
  "lastVerified": "2026-10-20",
  "sources": [
    "https://www.usbank.com/business-banking/business-credit-cards.html",
    "https://www.usbank.com/business-banking/business-credit-cards/amazon-business-credit-cards.html"
  ],
  "benefits": []
}
