{
  "$schema": "../../schema/card.schema.json",
  "id": "citi-my-best-buy-visa",
  "name": "My Best Buy Visa",
  "issuer": "CITI",
  "network": "visa",
  "isBusiness": false,
  "currency": "USD",
  "annualFee": 0,
  "afWaivedFirstYear": false,
  "discontinued": false,
  "url": "https://www.citi.com/credit-cards/citi-best-buy-credit-cards",
  "imageUrl": "https://aemapi.citi.com/content/dam/cfs/uspb/usmkt/cards/en/static/images/citi-best-buy-credit-cards/citi-best-buy-credit-cards1_306x192.png",
  "lastVerified": "2026-10-20",
  "sources": [
    "https://www.citi.com/credit-cards/citi-best-buy-credit-cards",
    "https://www.citi.com/credit-cards/view-all-credit-cards"
  ],
  "benefits": []
}
