{
  "$schema": "../../schema/card.schema.json",
  "id": "amex-cash-magnet",
  "name": "Cash Magnet",
  "issuer": "AMERICAN_EXPRESS",
  "network": "amex",
  "isBusiness": false,
  "currency": "USD",
  "annualFee": 0,
  "afWaivedFirstYear": false,
  "discontinued": true,
  "url": "https://www.americanexpress.com/us/credit-cards/card/cash-magnet/",
  "imageUrl": "https://icm.aexp-static.com/Internet/Acquisition/US_en/AppContent/OneSite/category/cardarts/cash-magnet.png",
  "legacyIds": [
    "27ebb66ce240c9dcf6e1d13d63e319b4"
  ],
  "lastVerified": "2026-11-01",
  "sources": [
    "https://www.americanexpress.com/us/credit-cards/card/cash-magnet/",
    "https://www.americanexpress.com/us/credit-cards/view-all-personal-credit-cards/",
    "https://www.americanexpress.com/us/credit-cards/category/all-cards/"
  ],
  "benefits": []
}
