{
  "$schema": "../../schema/card.schema.json",
  "id": "citi-simplicity",
  "name": "Simplicity",
  "issuer": "CITI",
  "network": "mastercard",
  "isBusiness": false,
  "currency": "USD",
  "annualFee": 0,
  "afWaivedFirstYear": false,
  "discontinued": false,
  "url": "https://www.citi.com/credit-cards/citi-simplicity-credit-card",
  "imageUrl": "https://aemapi.citi.com/content/dam/cfs/uspb/usmkt/cards/en/static/images/citi-simplicity-credit-card/citi-simplicity-credit-card_306x192.webp",
  "lastVerified": "2026-11-01",
  "sources": [
    "https://www.citi.com/credit-cards/citi-simplicity-credit-card",
    "https://www.citi.com/credit-cards/view-all-credit-cards"
  ],
  "benefits": []
}
