{
  "$schema": "../../schema/card.schema.json",
  "id": "boa-free-spirit",
  "name": "Free Spirit",
  "issuer": "BANK_OF_AMERICA",
  "network": "mastercard",
  "isBusiness": false,
  "currency": "SPIRIT",
  "annualFee": 79,
  "afWaivedFirstYear": true,
  "discontinued": true,
  "url": "https://www.bankofamerica.com/credit-cards/products/spirit-airlines-credit-card/",
  "imageUrl": "https://www.bankofamerica.com/content/images/ContextualSiteGraphics/CreditCardArt/en_US/Approved_PCM/ragb_eltcm_mc_blk_250.png",
  "legacyIds": [
    "541d121bd20b148d43a8c896d0de6830"
  ],
  "lastVerified": "2026-10-20",
  "sources": [
    "https://www.bankofamerica.com/credit-cards/products/spirit-airlines-credit-card/",
    "https://www.bankofamerica.com/credit-cards/"
  ],
  "benefits": []
}
